{
  "schema_version": 1,
  "local_plan_id": "bbbbbbbb-bbbb-4bbb-8bbb-bbbbbbbbbbbb",
  "owner_id": "33333333-3333-4333-8333-333333333333",
  "created_at": "2026-09-10T00:00:00Z",
  "expires_at": "2026-09-10T00:15:00Z",
  "software_id": "ops-core",
  "version": "1.2.4",
  "source": {"kind": "file", "origin": "fixtures/local-plan.json", "version": null, "digest": "cccccccccccccccccccccccccccccccccccccccccccccccccccccccccccccccc"},
  "params": {"restart": false},
  "impact": {"summary": "local user-confirmed update plan", "service_interruption": false, "data_risk": false, "restart_required": false},
  "plan_digest": "21a544118854fabb22a7a500fc1f9d0970f5712027ebb1c4404f1c36b8f00055"
}
